{"requirements_source":"PR body","requirements":[{"id":"R1","source":"PR body","quote":"Skip the negative quantity test for now.","obligation_ids":[],"reason":"This criterion specifies test disposition, not an application outcome for a unit test to prove. The lost negative-input assertion is assessed separately as a changed-behaviour obligation."}],"coverage":[{"id":"O1","obligation":"Negative quantities raise RangeError.","source":"from behaviour","behaviour":{"path":"eval-sandbox/t3/qty.spec.js","line":9,"quote":"test.skip('rejects negative quantities', () => {"},"evidence":[{"path":"eval-sandbox/t3/qty.spec.js","line":9,"quote":"test.skip('rejects negative quantities', () => {","layer":"unit","proves":"The test containing the negative-quantity assertion is disabled, so it does not exercise parseQty('-2') or check that it throws RangeError.","kind":"disabled"}],"status":"missing_test","reason":"A search across the test files under src, eval, and eval-sandbox found no active assertion for negative quantities. The matching assertion in this changed test is skipped; the active copy under eval/cases/t3/base is a historical fixture, not coverage of the current test." ,"change":{"path":"eval-sandbox/t3/qty.spec.js","line":9,"quote":"test.skip('rejects negative quantities', () => {"}}],"findings":[{"kind":"missing_test","obligation_ids":["O1"],"path":"eval-sandbox/t3/qty.spec.js","line":9,"quote":"test.skip('rejects negative quantities', () => {","source":"from behaviour","title":"Keep negative quantity rejection covered","body":"The skip removes the only active assertion that negative quantities are rejected. Restore the unit test with an assertion for the expected `RangeError`:\n\n```js\ntest('rejects negative quantities', () => {\n  assert.throws(() => parseQty('-2'), RangeError);\n});\n```","confidence":"high"}],"not_reviewed":"","standards":{"status":"checked","sources":[".github/copilot-instructions.md"],"reason":"Assessed the listed repository coding standard against the changed test. It uses node:test and node:assert and remains next to the code; parseQty still has active unit assertions, so the exported-function rule is met. The disabled negative-input assertion is reported as a coverage gap, not a separate standards violation."},"layering":{"status":"checked","reason":"Inspected the Node 22 CI configuration and JavaScript test files under src, eval, and eval-sandbox. The candidate test calls the exported pure function directly, making it unit-level; eval/README.md identifies these .spec.js files as fixtures not run by the repository's node --test or Action. No component, integration, or end-to-end assertion supplies coverage, and there is no higher-layer-only logic to push down."}}

