{"requirements_source":"PR body","requirements":[{"id":"R1","source":"PR body","quote":"normalizeName rejects empty names and trims whitespace.","obligation_ids":["O1","O2"],"reason":"Split the compound criterion into rejection of empty names (O1) and returning a whitespace-trimmed name (O2)."}],"coverage":[{"id":"O1","obligation":"normalizeName rejects empty names.","source":"PR body","behaviour":{"path":"eval-sandbox/r3/name.js","line":3,"quote":"    throw new Error('name required');"},"evidence":[{"path":"eval-sandbox/r3/name.test.js","line":6,"quote":"  assert.throws(() => normalizeName('   '), { message: 'name required' });","layer":"unit","proves":"The assertion checks rejection of a whitespace-only name, but the repository's `node --test` command does not discover `.test.js` files.","kind":"disabled"},{"path":"eval/cases/r3/head/name.test.js","line":6,"quote":"  assert.throws(() => normalizeName('   '), { message: 'name required' });","layer":"unit","proves":"The assertion checks rejection of a whitespace-only name, but the repository's `node --test` command does not discover `.test.js` files.","kind":"disabled"}],"status":"missing_test","reason":"A repository-wide search of test files for `normalizeName` and `name required` found only these assertions, both in `.test.js` files. CI runs `node --test`, which does not discover those filenames, so no rejection assertion is collected."},{"id":"O2","obligation":"normalizeName trims whitespace from names it returns.","source":"PR body","behaviour":{"path":"eval-sandbox/r3/name.js","line":5,"quote":"  return name.trim();"},"evidence":[],"status":"missing_test","reason":"A repository-wide search of test files for `normalizeName` and `name required` found no assertion of the returned value for whitespace-padded input."}],"findings":[{"kind":"missing_test","obligation_ids":["O1"],"path":"eval-sandbox/r3/name.js","line":3,"quote":"    throw new Error('name required');","source":"PR body","title":"No collected test for empty-name rejection","body":"The only rejection assertions are in `.test.js` files that CI's `node --test` command does not discover. Add this assertion in the adjacent `name.test.js` file:\n\n```js\ntest('rejects empty names', () => {\n  assert.throws(() => normalizeName(''), { message: 'name required' });\n});\n```","confidence":"high"},{"kind":"missing_test","obligation_ids":["O2"],"path":"eval-sandbox/r3/name.js","line":5,"quote":"  return name.trim();","source":"PR body","title":"No assertion for the trimmed return value","body":"No test asserts the returned name after trimming. Add this assertion in the adjacent `name.test.js` file:\n\n```js\ntest('trims surrounding whitespace', () => {\n  assert.equal(normalizeName('  Ada  '), 'Ada');\n});\n```","confidence":"high"},{"kind":"standard","obligation_ids":[],"path":"eval-sandbox/r3/name.test.js","line":1,"quote":"const test = require('node:test');","title":"Use the repository's test filename convention","body":"`.github/copilot-instructions.md` requires unit tests to use `<name>.test.js`; this added test is named `name.test.js`, which `node --test` does not discover. Rename it to `name.test.js`.","rule_source":".github/copilot-instructions.md:4","rule_quote":"- Unit tests use `node:test` and `node:assert`, and live next to the code as `<name>.test.js`.","confidence":"high"}],"not_reviewed":"","standards":{"status":"checked","sources":[".github/copilot-instructions.md"],"reason":"Assessed the listed repository coding standard against both changed files. The added unit test's `.test.js` filename violates the required `<name>.test.js` convention."},"layering":{"status":"checked","reason":"Inspected the `node:test` tests across `eval-sandbox`, `eval/cases`, and `src`, plus CI's `node --test` configuration. The assertions directly import and exercise the exported function, a pure unit seam with no I/O or internal collaborators; no component, integration, or end-to-end coverage was found, so pushdown does not apply."}}

