{"requirements_source":"PR body","requirements":[{"id":"R1","source":"PR body","quote":"Add a /quote endpoint that applies tier discounts and a bonus for big orders.","obligation_ids":["O1","O2","O3","O4"],"reason":"Split the criterion into the endpoint contract, the configured gold and silver tier-discount paths, and the big-order bonus. Other implementation-derived behaviors are assessed separately."}],"coverage":[{"id":"O1","obligation":"Expose POST /quote and return the calculated total in the response.","source":"PR body","behaviour":{"path":"eval-sandbox/l1/app.py","line":11,"quote":"    return jsonify(total=quote_total(body[\"items\"], body.get(\"tier\")))"},"evidence":[{"path":"eval-sandbox/l1/test_quote_api.py","line":7,"quote":"    assert resp.json[\"total\"] == 170.0","layer":"component","proves":"A POST to /quote with items and a gold tier returns a JSON total of 170.0."}],"status":"higher_level_only","reason":"The Flask test client exercises the route and response together with pricing, but no unit assertion checks the endpoint contract independently.","change":{"path":"eval-sandbox/l1/app.py","line":8,"quote":"@app.post(\"/quote\")"}},{"id":"O2","obligation":"Apply the configured gold-tier discount to the subtotal.","source":"PR body","behaviour":{"path":"eval-sandbox/l1/pricing.py","line":1,"quote":"TIER_DISCOUNT = {\"gold\": 0.15, \"silver\": 0.05}"},"evidence":[{"path":"eval-sandbox/l1/test_quote_api.py","line":7,"quote":"    assert resp.json[\"total\"] == 170.0","layer":"component","proves":"A 200.0 subtotal with gold tier yields the expected 170.0 total."}],"status":"higher_level_only","reason":"The gold calculation has an exact expected result at the API layer, but there is no direct unit assertion of the public pricing function.","change":{"path":"eval-sandbox/l1/pricing.py","line":1,"quote":"TIER_DISCOUNT = {\"gold\": 0.15, \"silver\": 0.05}"}},{"id":"O3","obligation":"Apply the configured silver-tier discount to the subtotal.","source":"PR body","behaviour":{"path":"eval-sandbox/l1/pricing.py","line":1,"quote":"TIER_DISCOUNT = {\"gold\": 0.15, \"silver\": 0.05}"},"evidence":[],"status":"missing_test","reason":"Searched the Python test files and references to the pricing symbol, tiers, and expected totals; no assertion exercises silver or checks its discounted total.","change":{"path":"eval-sandbox/l1/pricing.py","line":1,"quote":"TIER_DISCOUNT = {\"gold\": 0.15, \"silver\": 0.05}"}},{"id":"O4","obligation":"Add the $10 bonus only when the subtotal exceeds 500.","source":"PR body","behaviour":{"path":"eval-sandbox/l1/pricing.py","line":8,"quote":"    if subtotal > 500:"},"evidence":[{"path":"eval-sandbox/l1/test_quote_api.py","line":13,"quote":"    assert resp.json[\"total\"] == 590.0","layer":"component","proves":"A 600.0 subtotal without a tier discount returns 590.0, including the $10 bonus."}],"status":"higher_level_only","reason":"The component test checks an order above the threshold but does not distinguish the strict greater-than boundary from an inclusive threshold; no unit assertion calls quote_total directly.","change":{"path":"eval-sandbox/l1/pricing.py","line":8,"quote":"    if subtotal > 500:"}},{"id":"O5","obligation":"Sum price-times-quantity amounts across multiple items to form the subtotal.","source":"from behaviour","behaviour":{"path":"eval-sandbox/l1/pricing.py","line":5,"quote":"    subtotal = sum(i[\"price\"] * i[\"qty\"] for i in items)"},"evidence":[],"status":"missing_test","reason":"Searched all Python test files and pricing references; existing assertions use one item per request, so none checks aggregation across multiple items.","change":{"path":"eval-sandbox/l1/pricing.py","line":5,"quote":"    subtotal = sum(i[\"price\"] * i[\"qty\"] for i in items)"}},{"id":"O6","obligation":"Use a zero discount when the tier is omitted.","source":"from behaviour","behaviour":{"path":"eval-sandbox/l1/pricing.py","line":6,"quote":"    rate = TIER_DISCOUNT.get(tier, 0)"},"evidence":[{"path":"eval-sandbox/l1/test_quote_api.py","line":13,"quote":"    assert resp.json[\"total\"] == 590.0","layer":"component","proves":"For a 600.0 subtotal with no tier supplied, the result includes the $10 bonus and no tier discount."}],"status":"higher_level_only","reason":"The omitted-tier result is asserted through the Flask client, not through a unit test of quote_total.","change":{"path":"eval-sandbox/l1/pricing.py","line":6,"quote":"    rate = TIER_DISCOUNT.get(tier, 0)"}},{"id":"O7","obligation":"Round the returned quote total to two decimal places.","source":"from behaviour","behaviour":{"path":"eval-sandbox/l1/pricing.py","line":10,"quote":"    return round(subtotal - discount, 2)"},"evidence":[],"status":"missing_test","reason":"Searched all Python test files and total assertions; existing examples use whole-dollar amounts and do not check a fractional-cent calculation or rounded total.","change":{"path":"eval-sandbox/l1/pricing.py","line":10,"quote":"    return round(subtotal - discount, 2)"}}],"findings":[{"kind":"pushdown","obligation_ids":["O2","O6"],"path":"eval-sandbox/l1/pricing.py","line":6,"quote":"    rate = TIER_DISCOUNT.get(tier, 0)","source":"PR body","title":"Test tier pricing at the public unit seam","body":"Gold pricing and the omitted-tier fallback are asserted only through the Flask component test. Add direct return-value tests for `quote_total`, such as `quote_total([{\"price\": 100, \"qty\": 2}], \"gold\") == 170.0` and `quote_total([{\"price\": 100, \"qty\": 2}], None) == 200.0`. Keep the `/quote` tests for routing, request parsing, and JSON response wiring.","confidence":"high"},{"kind":"pushdown","obligation_ids":["O4"],"path":"eval-sandbox/l1/pricing.py","line":8,"quote":"    if subtotal > 500:","source":"PR body","title":"Unit-test the bonus threshold boundary","body":"The component assertion at `eval-sandbox/l1/test_quote_api.py:13` checks only a 600.0 subtotal, so it does not prove the strict threshold. Test the public `quote_total` seam directly with `quote_total([{\"price\": 500, \"qty\": 1}], None) == 500.0` and `quote_total([{\"price\": 501, \"qty\": 1}], None) == 491.0`. Retain the API test to verify the bonus is wired into the endpoint response.","confidence":"high"},{"kind":"missing_test","obligation_ids":["O3"],"path":"eval-sandbox/l1/pricing.py","line":1,"quote":"TIER_DISCOUNT = {\"gold\": 0.15, \"silver\": 0.05}","source":"PR body","title":"Cover the silver-tier discount","body":"No assertion checks the configured silver rate. Add a direct pricing test with an independent expected total:\n```python\nfrom pricing import quote_total\n\ndef test_applies_silver_tier_discount():\n    assert quote_total([{\"price\": 100, \"qty\": 2}], \"silver\") == 190.0\n```","confidence":"high"},{"kind":"missing_test","obligation_ids":["O5"],"path":"eval-sandbox/l1/pricing.py","line":5,"quote":"    subtotal = sum(i[\"price\"] * i[\"qty\"] for i in items)","title":"Test subtotal aggregation across items","body":"Existing requests contain only one item, so a regression that ignores later items would pass. Add a direct test with multiple items and a literal expected subtotal:\n```python\nfrom pricing import quote_total\n\ndef test_sums_multiple_items():\n    assert quote_total([{\"price\": 100, \"qty\": 1}, {\"price\": 50, \"qty\": 2}], None) == 200.0\n```","confidence":"high"},{"kind":"missing_test","obligation_ids":["O7"],"path":"eval-sandbox/l1/pricing.py","line":10,"quote":"    return round(subtotal - discount, 2)","title":"Test cent rounding of the returned total","body":"The current examples use whole-dollar totals and would not catch dropping the final rounding. Add a direct assertion with a fractional-cent calculation:\n```python\nfrom pricing import quote_total\n\ndef test_rounds_quote_total_to_cents():\n    assert quote_total([{\"price\": 100.01, \"qty\": 1}], \"gold\") == 85.01\n```","confidence":"high"},{"kind":"standard","obligation_ids":[],"path":"eval-sandbox/l1/pricing.py","line":4,"quote":"def quote_total(items, tier):","title":"Add a unit test for the public pricing function","body":"The repository standard requires a unit test for every exported function, but `quote_total` is only exercised through Flask test-client requests. Add direct assertions on its returned totals; retain the endpoint tests for HTTP wiring.","rule_source":".github/copilot-instructions.md:5","rule_quote":"- Every exported function needs a unit test that asserts on its return value or thrown error. A `typeof` check or \"does not throw\" alone does not count.","confidence":"high"}],"not_reviewed":"Tests were not executed; this is a static review.","standards":{"status":"checked","sources":[".github/copilot-instructions.md"],"reason":"Assessed the listed repository coding standard against the changed Python files. The Node/JavaScript-specific runtime and test-framework rules do not apply; the public-function unit-test rule applies and is reported, and the behavior-oriented test-name rule is followed."},"layering":{"status":"checked","reason":"Searched the Python test files and pricing/endpoint references across the repository. The Flask test-client checks exercise routing, request parsing, serialization, and pricing together, so they are component-level; quote_total is a public deterministic function with no collaborators and is a suitable unit seam. Keep component coverage for endpoint wiring while directly testing the pricing logic."}}

